{
  "version": "2.0",
  "summary": { "total_params": 40, "total_bytes": 992, "param_nodes": 2, "input_nodes": 1, "buffer_nodes": 0, "activation_nodes": 1, "custom_init_count": 0, "auto_graph_count": 2, "total_nodes": 4},
  "default_scope": "",
  "root": {"name": "root","path": "","kind": "module","module_type": "Model","formula": null,"total_params": 40,"total_bytes": 992,"param_count": 0,"node_count": 4,"children": [{"name": "conv2d","path": "conv2d","kind": "module","module_type": "Conv2D","formula": "y = x \\ast W + b","total_params": 40,"total_bytes": 736,"param_count": 2,"node_count": 3,"children": [],"parameters": [{"name": "conv2d.weight","shape": "[4, 1, 3, 3]","elements": 36,"bytes": 144,"status": "AUTO_GRAPH","strategy": "He Normal (gain=1.000)"},{"name": "conv2d.bias","shape": "[4]","elements": 4,"bytes": 16,"status": "AUTO_GRAPH","strategy": "zeros (0.0)"}],"ops": [{"op_type": "Conv2D","name": "outputs.feature_map","module": "conv2d","input_shape": "[1, 1, 8, 8]","param_shape": "weight: [4, 1, 3, 3], bias: [4]","output_shape": "[1, 4, 6, 6]","formula": "y = x \\ast W + b","elements": 144,"bytes": 576}],"ports": {"inputs": [],"outputs": []},"flow_nodes": [],"edges": [],"nodes": [{"name": "conv2d.weight","kind": "Param","module": "conv2d","shape": "[4, 1, 3, 3]","elements": 36,"bytes": 144,"status": "AUTO_GRAPH","act": "Linear (None)","strategy": "He Normal (gain=1.000)"},{"name": "conv2d.bias","kind": "Param","module": "conv2d","shape": "[4]","elements": 4,"bytes": 16,"status": "AUTO_GRAPH","act": "bias","strategy": "zeros (0.0)"},{"name": "outputs.feature_map","kind": "Activation","module": "conv2d","shape": "[1, 4, 6, 6]","elements": 144,"bytes": 576,"status": "OP_OUTPUT","act": "Conv2D","strategy": "produced by Conv2D"}]}],"parameters": [],"ops": [],"ports": {"inputs": [{"id": "@in0","ref": "inputs.x","shape": "[1, 1, 8, 8]"}],"outputs": [{"id": "@out0","ref": "outputs.feature_map","shape": "[1, 4, 6, 6]"}]},"flow_nodes": [{"id": "@in0","kind": "port_in","ref": "inputs.x","shape": "[1, 1, 8, 8]"},{"id": "conv2d","kind": "module","ref": "conv2d","module_type": "Conv2D","shape": ""},{"id": "@out0","kind": "port_out","ref": "outputs.feature_map","shape": "[1, 4, 6, 6]"}],"edges": [{"from": "@in0","to": "conv2d","shape": "[1, 1, 8, 8]","is_skip": false,"kind": "data"},{"from": "conv2d","to": "@out0","shape": "[1, 4, 6, 6]","is_skip": false,"kind": "data"}],"nodes": [{"name": "inputs.x","kind": "Input","module": "","shape": "[1, 1, 8, 8]","elements": 64,"bytes": 256,"status": "INPUT","act": "N/A","strategy": "user input"}]}
}