{
  "version": "2.0",
  "summary": { "total_params": 36, "total_bytes": 272, "param_nodes": 2, "input_nodes": 1, "buffer_nodes": 0, "activation_nodes": 2, "custom_init_count": 0, "auto_graph_count": 2, "total_nodes": 5},
  "default_scope": "",
  "root": {"name": "root","path": "","kind": "module","module_type": "Model","formula": null,"total_params": 36,"total_bytes": 272,"param_count": 0,"node_count": 5,"children": [{"name": "linear","path": "linear","kind": "module","module_type": "Linear","formula": "y = x W + b","total_params": 36,"total_bytes": 208,"param_count": 2,"node_count": 4,"children": [],"parameters": [{"name": "linear.weight","shape": "[8, 4]","elements": 32,"bytes": 128,"status": "AUTO_GRAPH","strategy": "He Normal (gain=1.000)"},{"name": "linear.bias","shape": "[1, 4]","elements": 4,"bytes": 16,"status": "AUTO_GRAPH","strategy": "zeros (0.0)"}],"ops": [{"op_type": "MatMul","name": "linear.act_MatMul_0","module": "linear","input_shape": "[2, 8]","param_shape": "weight: [8, 4]","output_shape": "[2, 4]","formula": "C = A \\cdot B","elements": 8,"bytes": 32},{"op_type": "Add","name": "outputs.y","module": "linear","input_shape": "[2, 4]","param_shape": "bias: [1, 4]","output_shape": "[2, 4]","formula": "C = A + B","elements": 8,"bytes": 32}],"ports": {"inputs": [],"outputs": []},"flow_nodes": [],"edges": [],"nodes": [{"name": "linear.weight","kind": "Param","module": "linear","shape": "[8, 4]","elements": 32,"bytes": 128,"status": "AUTO_GRAPH","act": "Linear (None)","strategy": "He Normal (gain=1.000)"},{"name": "linear.act_MatMul_0","kind": "Activation","module": "linear","shape": "[2, 4]","elements": 8,"bytes": 32,"status": "OP_OUTPUT","act": "MatMul","strategy": "produced by MatMul"},{"name": "linear.bias","kind": "Param","module": "linear","shape": "[1, 4]","elements": 4,"bytes": 16,"status": "AUTO_GRAPH","act": "bias","strategy": "zeros (0.0)"},{"name": "outputs.y","kind": "Activation","module": "linear","shape": "[2, 4]","elements": 8,"bytes": 32,"status": "OP_OUTPUT","act": "Add","strategy": "produced by Add"}]}],"parameters": [],"ops": [],"ports": {"inputs": [{"id": "@in0","ref": "inputs.x","shape": "[2, 8]"}],"outputs": [{"id": "@out0","ref": "outputs.y","shape": "[2, 4]"}]},"flow_nodes": [{"id": "@in0","kind": "port_in","ref": "inputs.x","shape": "[2, 8]"},{"id": "linear","kind": "module","ref": "linear","module_type": "Linear","shape": ""},{"id": "@out0","kind": "port_out","ref": "outputs.y","shape": "[2, 4]"}],"edges": [{"from": "@in0","to": "linear","shape": "[2, 8]","is_skip": false,"kind": "data"},{"from": "linear","to": "@out0","shape": "[2, 4]","is_skip": false,"kind": "data"}],"nodes": [{"name": "inputs.x","kind": "Input","module": "","shape": "[2, 8]","elements": 16,"bytes": 64,"status": "INPUT","act": "N/A","strategy": "user input"}]}
}