{
  "version": "2.0",
  "summary": { "total_params": 337, "total_bytes": 2948, "param_nodes": 6, "input_nodes": 1, "buffer_nodes": 0, "activation_nodes": 8, "custom_init_count": 0, "auto_graph_count": 6, "total_nodes": 15},
  "default_scope": "discriminator",
  "root": {"name": "root","path": "","kind": "module","module_type": "Model","formula": null,"total_params": 337,"total_bytes": 2948,"param_count": 0,"node_count": 15,"children": [{"name": "discriminator","path": "discriminator","kind": "module","module_type": "Discriminator","formula": "y = f(x; \\theta)","total_params": 337,"total_bytes": 2916,"param_count": 0,"node_count": 14,"children": [{"name": "fc1","path": "discriminator.fc1","kind": "module","module_type": "Linear","formula": "y = x W + b","total_params": 48,"total_bytes": 704,"param_count": 2,"node_count": 4,"children": [],"parameters": [{"name": "discriminator.fc1.weight","shape": "[2, 16]","elements": 32,"bytes": 128,"status": "AUTO_GRAPH","strategy": "He Normal (gain=1.387)"},{"name": "discriminator.fc1.bias","shape": "[1, 16]","elements": 16,"bytes": 64,"status": "AUTO_GRAPH","strategy": "zeros (0.0)"}],"ops": [{"op_type": "MatMul","name": "discriminator.fc1.act_MatMul_0","module": "discriminator.fc1","input_shape": "[4, 2]","param_shape": "weight: [2, 16]","output_shape": "[4, 16]","formula": "C = A \\cdot B","elements": 64,"bytes": 256},{"op_type": "Add","name": "discriminator.fc1.act_Add_1","module": "discriminator.fc1","input_shape": "[4, 16]","param_shape": "bias: [1, 16]","output_shape": "[4, 16]","formula": "C = A + B","elements": 64,"bytes": 256}],"ports": {"inputs": [],"outputs": []},"flow_nodes": [],"edges": [],"nodes": [{"name": "discriminator.fc1.weight","kind": "Param","module": "discriminator.fc1","shape": "[2, 16]","elements": 32,"bytes": 128,"status": "AUTO_GRAPH","act": "LeakyReLU","strategy": "He Normal (gain=1.387)"},{"name": "discriminator.fc1.act_MatMul_0","kind": "Activation","module": "discriminator.fc1","shape": "[4, 16]","elements": 64,"bytes": 256,"status": "OP_OUTPUT","act": "MatMul","strategy": "produced by MatMul"},{"name": "discriminator.fc1.bias","kind": "Param","module": "discriminator.fc1","shape": "[1, 16]","elements": 16,"bytes": 64,"status": "AUTO_GRAPH","act": "bias","strategy": "zeros (0.0)"},{"name": "discriminator.fc1.act_Add_1","kind": "Activation","module": "discriminator.fc1","shape": "[4, 16]","elements": 64,"bytes": 256,"status": "OP_OUTPUT","act": "Add","strategy": "produced by Add"}]},{"name": "fc2","path": "discriminator.fc2","kind": "module","module_type": "Linear","formula": "y = x W + b","total_params": 272,"total_bytes": 1600,"param_count": 2,"node_count": 4,"children": [],"parameters": [{"name": "discriminator.fc2.weight","shape": "[16, 16]","elements": 256,"bytes": 1024,"status": "AUTO_GRAPH","strategy": "He Normal (gain=1.387)"},{"name": "discriminator.fc2.bias","shape": "[1, 16]","elements": 16,"bytes": 64,"status": "AUTO_GRAPH","strategy": "zeros (0.0)"}],"ops": [{"op_type": "MatMul","name": "discriminator.fc2.act_MatMul_3","module": "discriminator.fc2","input_shape": "[4, 16]","param_shape": "weight: [16, 16]","output_shape": "[4, 16]","formula": "C = A \\cdot B","elements": 64,"bytes": 256},{"op_type": "Add","name": "discriminator.fc2.act_Add_4","module": "discriminator.fc2","input_shape": "[4, 16]","param_shape": "bias: [1, 16]","output_shape": "[4, 16]","formula": "C = A + B","elements": 64,"bytes": 256}],"ports": {"inputs": [],"outputs": []},"flow_nodes": [],"edges": [],"nodes": [{"name": "discriminator.fc2.weight","kind": "Param","module": "discriminator.fc2","shape": "[16, 16]","elements": 256,"bytes": 1024,"status": "AUTO_GRAPH","act": "LeakyReLU","strategy": "He Normal (gain=1.387)"},{"name": "discriminator.fc2.act_MatMul_3","kind": "Activation","module": "discriminator.fc2","shape": "[4, 16]","elements": 64,"bytes": 256,"status": "OP_OUTPUT","act": "MatMul","strategy": "produced by MatMul"},{"name": "discriminator.fc2.bias","kind": "Param","module": "discriminator.fc2","shape": "[1, 16]","elements": 16,"bytes": 64,"status": "AUTO_GRAPH","act": "bias","strategy": "zeros (0.0)"},{"name": "discriminator.fc2.act_Add_4","kind": "Activation","module": "discriminator.fc2","shape": "[4, 16]","elements": 64,"bytes": 256,"status": "OP_OUTPUT","act": "Add","strategy": "produced by Add"}]},{"name": "fc3","path": "discriminator.fc3","kind": "module","module_type": "Linear","formula": "y = x W + b","total_params": 17,"total_bytes": 100,"param_count": 2,"node_count": 4,"children": [],"parameters": [{"name": "discriminator.fc3.weight","shape": "[16, 1]","elements": 16,"bytes": 64,"status": "AUTO_GRAPH","strategy": "He Normal (gain=1.000)"},{"name": "discriminator.fc3.bias","shape": "[1, 1]","elements": 1,"bytes": 4,"status": "AUTO_GRAPH","strategy": "zeros (0.0)"}],"ops": [{"op_type": "MatMul","name": "discriminator.fc3.act_MatMul_6","module": "discriminator.fc3","input_shape": "[4, 16]","param_shape": "weight: [16, 1]","output_shape": "[4, 1]","formula": "C = A \\cdot B","elements": 4,"bytes": 16},{"op_type": "Add","name": "outputs.logits","module": "discriminator.fc3","input_shape": "[4, 1]","param_shape": "bias: [1, 1]","output_shape": "[4, 1]","formula": "C = A + B","elements": 4,"bytes": 16}],"ports": {"inputs": [],"outputs": []},"flow_nodes": [],"edges": [],"nodes": [{"name": "discriminator.fc3.weight","kind": "Param","module": "discriminator.fc3","shape": "[16, 1]","elements": 16,"bytes": 64,"status": "AUTO_GRAPH","act": "Linear (None)","strategy": "He Normal (gain=1.000)"},{"name": "discriminator.fc3.act_MatMul_6","kind": "Activation","module": "discriminator.fc3","shape": "[4, 1]","elements": 4,"bytes": 16,"status": "OP_OUTPUT","act": "MatMul","strategy": "produced by MatMul"},{"name": "discriminator.fc3.bias","kind": "Param","module": "discriminator.fc3","shape": "[1, 1]","elements": 1,"bytes": 4,"status": "AUTO_GRAPH","act": "bias","strategy": "zeros (0.0)"},{"name": "outputs.logits","kind": "Activation","module": "discriminator.fc3","shape": "[4, 1]","elements": 4,"bytes": 16,"status": "OP_OUTPUT","act": "Add","strategy": "produced by Add"}]}],"parameters": [],"ops": [{"op_type": "LeakyRelu","name": "discriminator.act_LeakyRelu_2","module": "discriminator","input_shape": "[4, 16]","param_shape": "None (Stateless)","output_shape": "[4, 16]","formula": "y = \\max(\\alpha x, x)","elements": 64,"bytes": 256},{"op_type": "LeakyRelu","name": "discriminator.act_LeakyRelu_5","module": "discriminator","input_shape": "[4, 16]","param_shape": "None (Stateless)","output_shape": "[4, 16]","formula": "y = \\max(\\alpha x, x)","elements": 64,"bytes": 256}],"ports": {"inputs": [{"id": "@in0","ref": "inputs.x","shape": "[4, 2]"}],"outputs": [{"id": "@out0","ref": "outputs.logits","shape": "[4, 1]"}]},"flow_nodes": [{"id": "@in0","kind": "port_in","ref": "inputs.x","shape": "[4, 2]"},{"id": "fc1","kind": "module","ref": "discriminator.fc1","module_type": "Linear","shape": ""},{"id": "act_LeakyRelu_2","kind": "op","ref": "discriminator.act_LeakyRelu_2","op_type": "LeakyRelu","shape": "[4, 16]"},{"id": "fc2","kind": "module","ref": "discriminator.fc2","module_type": "Linear","shape": ""},{"id": "act_LeakyRelu_5","kind": "op","ref": "discriminator.act_LeakyRelu_5","op_type": "LeakyRelu","shape": "[4, 16]"},{"id": "fc3","kind": "module","ref": "discriminator.fc3","module_type": "Linear","shape": ""},{"id": "@out0","kind": "port_out","ref": "outputs.logits","shape": "[4, 1]"}],"edges": [{"from": "@in0","to": "fc1","shape": "[4, 2]","is_skip": false,"kind": "data"},{"from": "fc1","to": "act_LeakyRelu_2","shape": "[4, 16]","is_skip": false,"kind": "data"},{"from": "act_LeakyRelu_2","to": "fc2","shape": "[4, 16]","is_skip": false,"kind": "data"},{"from": "fc2","to": "act_LeakyRelu_5","shape": "[4, 16]","is_skip": false,"kind": "data"},{"from": "act_LeakyRelu_5","to": "fc3","shape": "[4, 16]","is_skip": false,"kind": "data"},{"from": "fc3","to": "@out0","shape": "[4, 1]","is_skip": false,"kind": "data"}],"nodes": [{"name": "discriminator.act_LeakyRelu_2","kind": "Activation","module": "discriminator","shape": "[4, 16]","elements": 64,"bytes": 256,"status": "OP_OUTPUT","act": "LeakyRelu","strategy": "produced by LeakyRelu"},{"name": "discriminator.act_LeakyRelu_5","kind": "Activation","module": "discriminator","shape": "[4, 16]","elements": 64,"bytes": 256,"status": "OP_OUTPUT","act": "LeakyRelu","strategy": "produced by LeakyRelu"}]}],"parameters": [],"ops": [],"ports": {"inputs": [{"id": "@in0","ref": "inputs.x","shape": "[4, 2]"}],"outputs": [{"id": "@out0","ref": "outputs.logits","shape": "[4, 1]"}]},"flow_nodes": [{"id": "@in0","kind": "port_in","ref": "inputs.x","shape": "[4, 2]"},{"id": "discriminator","kind": "module","ref": "discriminator","module_type": "Discriminator","shape": ""},{"id": "@out0","kind": "port_out","ref": "outputs.logits","shape": "[4, 1]"}],"edges": [{"from": "@in0","to": "discriminator","shape": "[4, 2]","is_skip": false,"kind": "data"},{"from": "discriminator","to": "@out0","shape": "[4, 1]","is_skip": false,"kind": "data"}],"nodes": [{"name": "inputs.x","kind": "Input","module": "","shape": "[4, 2]","elements": 8,"bytes": 32,"status": "INPUT","act": "N/A","strategy": "user input"}]}
}