{
  "version": "2.0",
  "summary": { "total_params": 1242, "total_bytes": 6408, "param_nodes": 6, "input_nodes": 1, "buffer_nodes": 0, "activation_nodes": 8, "custom_init_count": 0, "auto_graph_count": 6, "total_nodes": 15},
  "default_scope": "mlp",
  "root": {"name": "root","path": "","kind": "module","module_type": "Model","formula": null,"total_params": 1242,"total_bytes": 6408,"param_count": 0,"node_count": 15,"children": [{"name": "mlp","path": "mlp","kind": "module","module_type": "MLP","formula": "h_1 = \\text{ReLU}(x W_1 + b_1), \\; h_2 = \\text{ReLU}(h_1 W_2 + b_2), \\; y = h_2 W_3 + b_3","total_params": 1242,"total_bytes": 6280,"param_count": 0,"node_count": 14,"children": [{"name": "fc1","path": "mlp.fc1","kind": "module","module_type": "Linear","formula": "y = x W + b","total_params": 544,"total_bytes": 2688,"param_count": 2,"node_count": 4,"children": [],"parameters": [{"name": "mlp.fc1.weight","shape": "[16, 32]","elements": 512,"bytes": 2048,"status": "AUTO_GRAPH","strategy": "He Normal (gain=1.414)"},{"name": "mlp.fc1.bias","shape": "[1, 32]","elements": 32,"bytes": 128,"status": "AUTO_GRAPH","strategy": "zeros (0.0)"}],"ops": [{"op_type": "MatMul","name": "mlp.fc1.act_MatMul_0","module": "mlp.fc1","input_shape": "[2, 16]","param_shape": "weight: [16, 32]","output_shape": "[2, 32]","formula": "C = A \\cdot B","elements": 64,"bytes": 256},{"op_type": "Add","name": "mlp.fc1.act_Add_1","module": "mlp.fc1","input_shape": "[2, 32]","param_shape": "bias: [1, 32]","output_shape": "[2, 32]","formula": "C = A + B","elements": 64,"bytes": 256}],"ports": {"inputs": [],"outputs": []},"flow_nodes": [],"edges": [],"nodes": [{"name": "mlp.fc1.weight","kind": "Param","module": "mlp.fc1","shape": "[16, 32]","elements": 512,"bytes": 2048,"status": "AUTO_GRAPH","act": "ReLU","strategy": "He Normal (gain=1.414)"},{"name": "mlp.fc1.act_MatMul_0","kind": "Activation","module": "mlp.fc1","shape": "[2, 32]","elements": 64,"bytes": 256,"status": "OP_OUTPUT","act": "MatMul","strategy": "produced by MatMul"},{"name": "mlp.fc1.bias","kind": "Param","module": "mlp.fc1","shape": "[1, 32]","elements": 32,"bytes": 128,"status": "AUTO_GRAPH","act": "bias","strategy": "zeros (0.0)"},{"name": "mlp.fc1.act_Add_1","kind": "Activation","module": "mlp.fc1","shape": "[2, 32]","elements": 64,"bytes": 256,"status": "OP_OUTPUT","act": "Add","strategy": "produced by Add"}]},{"name": "fc2","path": "mlp.fc2","kind": "module","module_type": "Linear","formula": "y = x W + b","total_params": 528,"total_bytes": 2368,"param_count": 2,"node_count": 4,"children": [],"parameters": [{"name": "mlp.fc2.weight","shape": "[32, 16]","elements": 512,"bytes": 2048,"status": "AUTO_GRAPH","strategy": "He Normal (gain=1.414)"},{"name": "mlp.fc2.bias","shape": "[1, 16]","elements": 16,"bytes": 64,"status": "AUTO_GRAPH","strategy": "zeros (0.0)"}],"ops": [{"op_type": "MatMul","name": "mlp.fc2.act_MatMul_3","module": "mlp.fc2","input_shape": "[2, 32]","param_shape": "weight: [32, 16]","output_shape": "[2, 16]","formula": "C = A \\cdot B","elements": 32,"bytes": 128},{"op_type": "Add","name": "mlp.fc2.act_Add_4","module": "mlp.fc2","input_shape": "[2, 16]","param_shape": "bias: [1, 16]","output_shape": "[2, 16]","formula": "C = A + B","elements": 32,"bytes": 128}],"ports": {"inputs": [],"outputs": []},"flow_nodes": [],"edges": [],"nodes": [{"name": "mlp.fc2.weight","kind": "Param","module": "mlp.fc2","shape": "[32, 16]","elements": 512,"bytes": 2048,"status": "AUTO_GRAPH","act": "ReLU","strategy": "He Normal (gain=1.414)"},{"name": "mlp.fc2.act_MatMul_3","kind": "Activation","module": "mlp.fc2","shape": "[2, 16]","elements": 32,"bytes": 128,"status": "OP_OUTPUT","act": "MatMul","strategy": "produced by MatMul"},{"name": "mlp.fc2.bias","kind": "Param","module": "mlp.fc2","shape": "[1, 16]","elements": 16,"bytes": 64,"status": "AUTO_GRAPH","act": "bias","strategy": "zeros (0.0)"},{"name": "mlp.fc2.act_Add_4","kind": "Activation","module": "mlp.fc2","shape": "[2, 16]","elements": 32,"bytes": 128,"status": "OP_OUTPUT","act": "Add","strategy": "produced by Add"}]},{"name": "fc3","path": "mlp.fc3","kind": "module","module_type": "Linear","formula": "y = x W + b","total_params": 170,"total_bytes": 840,"param_count": 2,"node_count": 4,"children": [],"parameters": [{"name": "mlp.fc3.weight","shape": "[16, 10]","elements": 160,"bytes": 640,"status": "AUTO_GRAPH","strategy": "He Normal (gain=1.000)"},{"name": "mlp.fc3.bias","shape": "[1, 10]","elements": 10,"bytes": 40,"status": "AUTO_GRAPH","strategy": "zeros (0.0)"}],"ops": [{"op_type": "MatMul","name": "mlp.fc3.act_MatMul_6","module": "mlp.fc3","input_shape": "[2, 16]","param_shape": "weight: [16, 10]","output_shape": "[2, 10]","formula": "C = A \\cdot B","elements": 20,"bytes": 80},{"op_type": "Add","name": "outputs.logits","module": "mlp.fc3","input_shape": "[2, 10]","param_shape": "bias: [1, 10]","output_shape": "[2, 10]","formula": "C = A + B","elements": 20,"bytes": 80}],"ports": {"inputs": [],"outputs": []},"flow_nodes": [],"edges": [],"nodes": [{"name": "mlp.fc3.weight","kind": "Param","module": "mlp.fc3","shape": "[16, 10]","elements": 160,"bytes": 640,"status": "AUTO_GRAPH","act": "Linear (None)","strategy": "He Normal (gain=1.000)"},{"name": "mlp.fc3.act_MatMul_6","kind": "Activation","module": "mlp.fc3","shape": "[2, 10]","elements": 20,"bytes": 80,"status": "OP_OUTPUT","act": "MatMul","strategy": "produced by MatMul"},{"name": "mlp.fc3.bias","kind": "Param","module": "mlp.fc3","shape": "[1, 10]","elements": 10,"bytes": 40,"status": "AUTO_GRAPH","act": "bias","strategy": "zeros (0.0)"},{"name": "outputs.logits","kind": "Activation","module": "mlp.fc3","shape": "[2, 10]","elements": 20,"bytes": 80,"status": "OP_OUTPUT","act": "Add","strategy": "produced by Add"}]}],"parameters": [],"ops": [{"op_type": "Relu","name": "mlp.act_Relu_2","module": "mlp","input_shape": "[2, 32]","param_shape": "None (Stateless)","output_shape": "[2, 32]","formula": "y = \\max(0, x)","elements": 64,"bytes": 256},{"op_type": "Relu","name": "mlp.act_Relu_5","module": "mlp","input_shape": "[2, 16]","param_shape": "None (Stateless)","output_shape": "[2, 16]","formula": "y = \\max(0, x)","elements": 32,"bytes": 128}],"ports": {"inputs": [{"id": "@in0","ref": "inputs.x","shape": "[2, 16]"}],"outputs": [{"id": "@out0","ref": "outputs.logits","shape": "[2, 10]"}]},"flow_nodes": [{"id": "@in0","kind": "port_in","ref": "inputs.x","shape": "[2, 16]"},{"id": "fc1","kind": "module","ref": "mlp.fc1","module_type": "Linear","shape": ""},{"id": "act_Relu_2","kind": "op","ref": "mlp.act_Relu_2","op_type": "Relu","shape": "[2, 32]"},{"id": "fc2","kind": "module","ref": "mlp.fc2","module_type": "Linear","shape": ""},{"id": "act_Relu_5","kind": "op","ref": "mlp.act_Relu_5","op_type": "Relu","shape": "[2, 16]"},{"id": "fc3","kind": "module","ref": "mlp.fc3","module_type": "Linear","shape": ""},{"id": "@out0","kind": "port_out","ref": "outputs.logits","shape": "[2, 10]"}],"edges": [{"from": "@in0","to": "fc1","shape": "[2, 16]","is_skip": false,"kind": "data"},{"from": "fc1","to": "act_Relu_2","shape": "[2, 32]","is_skip": false,"kind": "data"},{"from": "act_Relu_2","to": "fc2","shape": "[2, 32]","is_skip": false,"kind": "data"},{"from": "fc2","to": "act_Relu_5","shape": "[2, 16]","is_skip": false,"kind": "data"},{"from": "act_Relu_5","to": "fc3","shape": "[2, 16]","is_skip": false,"kind": "data"},{"from": "fc3","to": "@out0","shape": "[2, 10]","is_skip": false,"kind": "data"}],"nodes": [{"name": "mlp.act_Relu_2","kind": "Activation","module": "mlp","shape": "[2, 32]","elements": 64,"bytes": 256,"status": "OP_OUTPUT","act": "Relu","strategy": "produced by Relu"},{"name": "mlp.act_Relu_5","kind": "Activation","module": "mlp","shape": "[2, 16]","elements": 32,"bytes": 128,"status": "OP_OUTPUT","act": "Relu","strategy": "produced by Relu"}]}],"parameters": [],"ops": [],"ports": {"inputs": [{"id": "@in0","ref": "inputs.x","shape": "[2, 16]"}],"outputs": [{"id": "@out0","ref": "outputs.logits","shape": "[2, 10]"}]},"flow_nodes": [{"id": "@in0","kind": "port_in","ref": "inputs.x","shape": "[2, 16]"},{"id": "mlp","kind": "module","ref": "mlp","module_type": "MLP","shape": ""},{"id": "@out0","kind": "port_out","ref": "outputs.logits","shape": "[2, 10]"}],"edges": [{"from": "@in0","to": "mlp","shape": "[2, 16]","is_skip": false,"kind": "data"},{"from": "mlp","to": "@out0","shape": "[2, 10]","is_skip": false,"kind": "data"}],"nodes": [{"name": "inputs.x","kind": "Input","module": "","shape": "[2, 16]","elements": 32,"bytes": 128,"status": "INPUT","act": "N/A","strategy": "user input"}]}
}